{
  "schema_version": "engineering-slice-plan.v1",
  "work_request": {"id": "wr-synthetic-read-only", "state_version": 1, "canonical_record_digest": "sha256:cccccccccccccccccccccccccccccccccccccccccccccccccccccccccccccccc"},
  "accepted_plan_revision": {"id": "plan-synthetic-read", "revision": 1, "digest": "sha256:aaaaaaaaaaaaaaaaaaaaaaaaaaaaaaaaaaaaaaaaaaaaaaaaaaaaaaaaaaaaaaaa"},
  "plan_digest": "sha256:4986a3f0576b71f827167fd7d9ad0202c2effcf0308ba815b2414623277f1423",
  "slices": [
    {"slice_ref":"slice:a","ordinal":1,"objective":"Implement typed contracts","definition_of_done":"Plan and receipt schemas validate","dependency_refs":[],"declared_resource_refs":["resource:worktree-a"],"declared_component_refs":["component:execution-fabric"],"declared_plan_step_refs":["step:synthetic-read"],"baseline_evidence_refs":[{"ref":"evidence:baseline","redaction_class":"redacted_evidence","content_digest":"sha256:aaaaaaaaaaaaaaaaaaaaaaaaaaaaaaaaaaaaaaaaaaaaaaaaaaaaaaaaaaaaaaaa"}],"planned_checks":[{"check_ref":"check:contracts","failure_condition":"unknown fields are accepted","evidence_requirement":"redacted_evidence_required"}],"scope_boundary":"contract files and validators","forbidden_change_refs":["forbidden:authority"],"concurrency_posture":"parallel_safe","manual_qa_required":false,"risk_class":"R1","release_requirement":"required"},
    {"slice_ref":"slice:b","ordinal":2,"objective":"Implement deterministic runtime","definition_of_done":"Eligibility and projection are deterministic","dependency_refs":[],"declared_resource_refs":["resource:worktree-a"],"declared_component_refs":["component:execution-fabric"],"declared_plan_step_refs":["step:synthetic-read"],"baseline_evidence_refs":[{"ref":"evidence:baseline","redaction_class":"redacted_evidence","content_digest":"sha256:aaaaaaaaaaaaaaaaaaaaaaaaaaaaaaaaaaaaaaaaaaaaaaaaaaaaaaaaaaaaaaaa"}],"planned_checks":[{"check_ref":"check:runtime","failure_condition":"cycles or inherited authority pass","evidence_requirement":"redacted_evidence_required"}],"scope_boundary":"offline runtime module","forbidden_change_refs":["forbidden:database"],"concurrency_posture":"parallel_safe","manual_qa_required":false,"risk_class":"R1","release_requirement":"required"},
    {"slice_ref":"slice:c","ordinal":3,"objective":"Integrate the passport projection","definition_of_done":"Model Room can render a typed passport","dependency_refs":["slice:a","slice:b"],"declared_resource_refs":["resource:worktree-a"],"declared_component_refs":["component:execution-fabric"],"declared_plan_step_refs":["step:synthetic-read"],"baseline_evidence_refs":[{"ref":"evidence:baseline","redaction_class":"redacted_evidence","content_digest":"sha256:aaaaaaaaaaaaaaaaaaaaaaaaaaaaaaaaaaaaaaaaaaaaaaaaaaaaaaaaaaaaaaaa"}],"planned_checks":[{"check_ref":"check:room","failure_condition":"existing card behavior changes without typed fact","evidence_requirement":"redacted_evidence_required"}],"scope_boundary":"wire and additive reader section","forbidden_change_refs":["forbidden:task-ui"],"concurrency_posture":"serial_after_dependencies","manual_qa_required":true,"risk_class":"R2","release_requirement":"required"}
  ]
}
